{"project":"aether","seed":42,"mode":"native","spec":{"prompt":"floating island; platforms 4; bridges on; water puzzle; bodies 3","platforms":4,"bridges":true,"water":true,"bodies":3,"gravity":9.81,"wind":0},"summary":{"steps":2400,"dt":0.00833333333333,"geometry_count":54,"body_count":3,"initial_water_total":14,"water_total":14,"volume_error":2.13162820728e-14,"max_penetration":0,"validation":{"ok":true,"checks":232,"repair_budget":32,"violations":[],"repairs":[]}},"geometry":[{"id":"catch_floor","kind":"floor","color":"#102335","position":[0,-10,0],"size":[80,1,80],"solid":true,"vertices":[-40,-0.5,-40,40,-0.5,-40,-40,0.5,-40,40,0.5,-40,-40,-0.5,40,40,-0.5,40,-40,0.5,40,40,0.5,40],"indices":[0,2,3,0,3,1,4,5,7,4,7,6,0,1,5,0,5,4,2,6,7,2,7,3,0,4,6,0,6,2,1,3,7,1,7,5]},{"id":"island","kind":"island","color":"#3d6570","position":[0,0,0],"size":[18,2,18],"solid":true,"vertices":[-9,-1,-9,9,-1,-9,-9,1,-9,9,1,-9,-9,-1,9,9,-1,9,-9,1,9,9,1,9],"indices":[0,2,3,0,3,1,4,5,7,4,7,6,0,1,5,0,5,4,2,6,7,2,7,3,0,4,6,0,6,2,1,3,7,1,7,5]},{"id":"island_rock","kind":"rock","color":"#274451","position":[0,-1,0],"size":[18,6,18],"solid":false,"vertices":[9,-0.05,0,6.36396103068,-0.05,6.36396103068,5.51091059616e-16,-0.05,9,-6.36396103068,-0.05,6.36396103068,-9,-0.05,1.10218211923e-15,-6.36396103068,-0.05,-6.36396103068,-1.65327317885e-15,-0.05,-9,6.36396103068,-0.05,-6.36396103068,0,-6,0],"indices":[0,1,8,1,2,8,2,3,8,3,4,8,4,5,8,5,6,8,6,7,8,7,0,8]},{"id":"platform_0","kind":"platform","color":"#547a87","position":[12,0.75,0],"size":[5,1.5,5],"solid":true,"vertices":[-2.5,-0.75,-2.5,2.5,-0.75,-2.5,-2.5,0.75,-2.5,2.5,0.75,-2.5,-2.5,-0.75,2.5,2.5,-0.75,2.5,-2.5,0.75,2.5,2.5,0.75,2.5],"indices":[0,2,3,0,3,1,4,5,7,4,7,6,0,1,5,0,5,4,2,6,7,2,7,3,0,4,6,0,6,2,1,3,7,1,7,5]},{"id":"bridge_x_0","kind":"bridge","color":"#a98560","position":[6,1.1,0],"size":[12,0.8,1.6],"solid":true,"vertices":[-6,-0.4,-0.8,6,-0.4,-0.8,-6,0.4,-0.8,6,0.4,-0.8,-6,-0.4,0.8,6,-0.4,0.8,-6,0.4,0.8,6,0.4,0.8],"indices":[0,2,3,0,3,1,4,5,7,4,7,6,0,1,5,0,5,4,2,6,7,2,7,3,0,4,6,0,6,2,1,3,7,1,7,5]},{"id":"grass_0_0","kind":"grass","color":"#8fbc8b","position":[11.009380579,1.5,-1.64750003815],"size":[0.14,0.538640588522,0.14],"solid":false,"vertices":[-0.07,0,0,0.07,0,0,0,0.538640588522,0,0,0,-0.07,0,0,0.07,0,0.538640588522,0],"indices":[0,1,2,3,4,5]},{"id":"grass_0_1","kind":"grass","color":"#8fbc8b","position":[10.8902168274,1.5,-0.497359275818],"size":[0.14,0.262831926346,0.14],"solid":false,"vertices":[-0.07,0,0,0.07,0,0,0,0.262831926346,0,0,0,-0.07,0,0,0.07,0,0.262831926346,0],"indices":[0,1,2,3,4,5]},{"id":"grass_0_2","kind":"grass","color":"#8fbc8b","position":[11.7891249657,1.5,-1.52616000175],"size":[0.14,0.686906844378,0.14],"solid":false,"vertices":[-0.07,0,0,0.07,0,0,0,0.686906844378,0,0,0,-0.07,0,0,0.07,0,0.686906844378,0],"indices":[0,1,2,3,4,5]},{"id":"grass_0_3","kind":"grass","color":"#8fbc8b","position":[13.9785370827,1.5,1.41281080246],"size":[0.14,0.499838352203,0.14],"solid":false,"vertices":[-0.07,0,0,0.07,0,0,0,0.499838352203,0,0,0,-0.07,0,0,0.07,0,0.499838352203,0],"indices":[0,1,2,3,4,5]},{"id":"grass_0_4","kind":"grass","color":"#8fbc8b","position":[12.5680036545,1.5,1.44582462311],"size":[0.14,0.548234879971,0.14],"solid":false,"vertices":[-0.07,0,0,0.07,0,0,0,0.548234879971,0,0,0,-0.07,0,0,0.07,0,0.548234879971,0],"indices":[0,1,2,3,4,5]},{"id":"grass_0_5","kind":"grass","color":"#8fbc8b","position":[10.3630003929,1.5,-1.43916082382],"size":[0.14,0.725044131279,0.14],"solid":false,"vertices":[-0.07,0,0,0.07,0,0,0,0.725044131279,0,0,0,-0.07,0,0,0.07,0,0.725044131279,0],"indices":[0,1,2,3,4,5]},{"id":"platform_1","kind":"platform","color":"#547a87","position":[0,0.75,12],"size":[5,1.5,5],"solid":true,"vertices":[-2.5,-0.75,-2.5,2.5,-0.75,-2.5,-2.5,0.75,-2.5,2.5,0.75,-2.5,-2.5,-0.75,2.5,2.5,-0.75,2.5,-2.5,0.75,2.5,2.5,0.75,2.5],"indices":[0,2,3,0,3,1,4,5,7,4,7,6,0,1,5,0,5,4,2,6,7,2,7,3,0,4,6,0,6,2,1,3,7,1,7,5]},{"id":"bridge_z_1","kind":"bridge","color":"#a98560","position":[0,1.1,6],"size":[1.6,0.8,12],"solid":true,"vertices":[-0.8,-0.4,-6,0.8,-0.4,-6,-0.8,0.4,-6,0.8,0.4,-6,-0.8,-0.4,6,0.8,-0.4,6,-0.8,0.4,6,0.8,0.4,6],"indices":[0,2,3,0,3,1,4,5,7,4,7,6,0,1,5,0,5,4,2,6,7,2,7,3,0,4,6,0,6,2,1,3,7,1,7,5]},{"id":"grass_1_0","kind":"grass","color":"#8fbc8b","position":[1.6982216835,1.5,13.5578756332],"size":[0.14,0.525254160166,0.14],"solid":false,"vertices":[-0.07,0,0,0.07,0,0,0,0.525254160166,0,0,0,-0.07,0,0,0.07,0,0.525254160166,0],"indices":[0,1,2,3,4,5]},{"id":"grass_1_1","kind":"grass","color":"#8fbc8b","position":[-1.27793383598,1.5,12.2003417015],"size":[0.14,0.379483371973,0.14],"solid":false,"vertices":[-0.07,0,0,0.07,0,0,0,0.379483371973,0,0,0,-0.07,0,0,0.07,0,0.379483371973,0],"indices":[0,1,2,3,4,5]},{"id":"grass_1_2","kind":"grass","color":"#8fbc8b","position":[1.77248644829,1.5,13.286003828],"size":[0.14,0.327646940947,0.14],"solid":false,"vertices":[-0.07,0,0,0.07,0,0,0,0.327646940947,0,0,0,-0.07,0,0,0.07,0,0.327646940947,0],"indices":[0,1,2,3,4,5]},{"id":"grass_1_3","kind":"grass","color":"#8fbc8b","position":[1.31757879257,1.5,11.8676891327],"size":[0.14,0.280352413654,0.14],"solid":false,"vertices":[-0.07,0,0,0.07,0,0,0,0.280352413654,0,0,0,-0.07,0,0,0.07,0,0.280352413654,0],"indices":[0,1,2,3,4,5]},{"id":"grass_1_4","kind":"grass","color":"#8fbc8b","position":[-1.91017913818,1.5,12.1491549015],"size":[0.14,0.664980113506,0.14],"solid":false,"vertices":[-0.07,0,0,0.07,0,0,0,0.664980113506,0,0,0,-0.07,0,0,0.07,0,0.664980113506,0],"indices":[0,1,2,3,4,5]},{"id":"grass_1_5","kind":"grass","color":"#8fbc8b","position":[1.38132834435,1.5,12.7236721516],"size":[0.14,0.440379023552,0.14],"solid":false,"vertices":[-0.07,0,0,0.07,0,0,0,0.440379023552,0,0,0,-0.07,0,0,0.07,0,0.440379023552,0],"indices":[0,1,2,3,4,5]},{"id":"platform_2","kind":"platform","color":"#547a87","position":[-12,0.75,0],"size":[5,1.5,5],"solid":true,"vertices":[-2.5,-0.75,-2.5,2.5,-0.75,-2.5,-2.5,0.75,-2.5,2.5,0.75,-2.5,-2.5,-0.75,2.5,2.5,-0.75,2.5,-2.5,0.75,2.5,2.5,0.75,2.5],"indices":[0,2,3,0,3,1,4,5,7,4,7,6,0,1,5,0,5,4,2,6,7,2,7,3,0,4,6,0,6,2,1,3,7,1,7,5]},{"id":"bridge_x_2","kind":"bridge","color":"#a98560","position":[-6,1.1,0],"size":[12,0.8,1.6],"solid":true,"vertices":[-6,-0.4,-0.8,6,-0.4,-0.8,-6,0.4,-0.8,6,0.4,-0.8,-6,-0.4,0.8,6,-0.4,0.8,-6,0.4,0.8,6,0.4,0.8],"indices":[0,2,3,0,3,1,4,5,7,4,7,6,0,1,5,0,5,4,2,6,7,2,7,3,0,4,6,0,6,2,1,3,7,1,7,5]},{"id":"grass_2_0","kind":"grass","color":"#8fbc8b","position":[-11.6573727131,1.5,0.785588502884],"size":[0.14,0.60568267107,0.14],"solid":false,"vertices":[-0.07,0,0,0.07,0,0,0,0.60568267107,0,0,0,-0.07,0,0,0.07,0,0.60568267107,0],"indices":[0,1,2,3,4,5]},{"id":"grass_2_1","kind":"grass","color":"#8fbc8b","position":[-11.1255278587,1.5,1.96114969254],"size":[0.14,0.474876403809,0.14],"solid":false,"vertices":[-0.07,0,0,0.07,0,0,0,0.474876403809,0,0,0,-0.07,0,0,0.07,0,0.474876403809,0],"indices":[0,1,2,3,4,5]},{"id":"grass_2_2","kind":"grass","color":"#8fbc8b","position":[-13.608294487,1.5,-1.23362350464],"size":[0.14,0.473689287901,0.14],"solid":false,"vertices":[-0.07,0,0,0.07,0,0,0,0.473689287901,0,0,0,-0.07,0,0,0.07,0,0.473689287901,0],"indices":[0,1,2,3,4,5]},{"id":"grass_2_3","kind":"grass","color":"#8fbc8b","position":[-13.491995573,1.5,1.07505941391],"size":[0.14,0.546860218048,0.14],"solid":false,"vertices":[-0.07,0,0,0.07,0,0,0,0.546860218048,0,0,0,-0.07,0,0,0.07,0,0.546860218048,0],"indices":[0,1,2,3,4,5]},{"id":"grass_2_4","kind":"grass","color":"#8fbc8b","position":[-10.7814238071,1.5,-0.442354679108],"size":[0.14,0.357884526253,0.14],"solid":false,"vertices":[-0.07,0,0,0.07,0,0,0,0.357884526253,0,0,0,-0.07,0,0,0.07,0,0.357884526253,0],"indices":[0,1,2,3,4,5]},{"id":"grass_2_5","kind":"grass","color":"#8fbc8b","position":[-12.9117622375,1.5,-1.92366123199],"size":[0.14,0.388985902071,0.14],"solid":false,"vertices":[-0.07,0,0,0.07,0,0,0,0.388985902071,0,0,0,-0.07,0,0,0.07,0,0.388985902071,0],"indices":[0,1,2,3,4,5]},{"id":"platform_3","kind":"platform","color":"#547a87","position":[0,0.75,-12],"size":[5,1.5,5],"solid":true,"vertices":[-2.5,-0.75,-2.5,2.5,-0.75,-2.5,-2.5,0.75,-2.5,2.5,0.75,-2.5,-2.5,-0.75,2.5,2.5,-0.75,2.5,-2.5,0.75,2.5,2.5,0.75,2.5],"indices":[0,2,3,0,3,1,4,5,7,4,7,6,0,1,5,0,5,4,2,6,7,2,7,3,0,4,6,0,6,2,1,3,7,1,7,5]},{"id":"bridge_z_3","kind":"bridge","color":"#a98560","position":[0,1.1,-6],"size":[1.6,0.8,12],"solid":true,"vertices":[-0.8,-0.4,-6,0.8,-0.4,-6,-0.8,0.4,-6,0.8,0.4,-6,-0.8,-0.4,6,0.8,-0.4,6,-0.8,0.4,6,0.8,0.4,6],"indices":[0,2,3,0,3,1,4,5,7,4,7,6,0,1,5,0,5,4,2,6,7,2,7,3,0,4,6,0,6,2,1,3,7,1,7,5]},{"id":"grass_3_0","kind":"grass","color":"#8fbc8b","position":[-0.664126873016,1.5,-10.4685356617],"size":[0.14,0.727939009666,0.14],"solid":false,"vertices":[-0.07,0,0,0.07,0,0,0,0.727939009666,0,0,0,-0.07,0,0,0.07,0,0.727939009666,0],"indices":[0,1,2,3,4,5]},{"id":"grass_3_1","kind":"grass","color":"#8fbc8b","position":[-1.22920560837,1.5,-10.5147960186],"size":[0.14,0.541161447763,0.14],"solid":false,"vertices":[-0.07,0,0,0.07,0,0,0,0.541161447763,0,0,0,-0.07,0,0,0.07,0,0.541161447763,0],"indices":[0,1,2,3,4,5]},{"id":"grass_3_2","kind":"grass","color":"#8fbc8b","position":[-0.653275728226,1.5,-12.7426903248],"size":[0.14,0.31467962265,0.14],"solid":false,"vertices":[-0.07,0,0,0.07,0,0,0,0.31467962265,0,0,0,-0.07,0,0,0.07,0,0.31467962265,0],"indices":[0,1,2,3,4,5]},{"id":"grass_3_3","kind":"grass","color":"#8fbc8b","position":[1.91988062859,1.5,-13.5881092548],"size":[0.14,0.710756838322,0.14],"solid":false,"vertices":[-0.07,0,0,0.07,0,0,0,0.710756838322,0,0,0,-0.07,0,0,0.07,0,0.710756838322,0],"indices":[0,1,2,3,4,5]},{"id":"grass_3_4","kind":"grass","color":"#8fbc8b","position":[1.22294020653,1.5,-12.2681751251],"size":[0.14,0.605030119419,0.14],"solid":false,"vertices":[-0.07,0,0,0.07,0,0,0,0.605030119419,0,0,0,-0.07,0,0,0.07,0,0.605030119419,0],"indices":[0,1,2,3,4,5]},{"id":"grass_3_5","kind":"grass","color":"#8fbc8b","position":[-0.773341655731,1.5,-13.5256276131],"size":[0.14,0.5046167